{
  "schemaVersion": 1,
  "generatedAt": "2026-10-23T23:56:18+08:00",
  "status": "ok",
  "source": {
    "数学错题本.md": "2e41a6d3",
    "数学二追踪表.md": "3d8cdd17",
    "408追踪表.md": "70c046d8",
    "408错题本.md": "adb9cea6",
    "规划与反思.md": "716f31ef",
    "英语政治追踪表.md": "c5df5ef7",
    "每日记录.md": "8086e996"
  },
  "validation": {
    "errors": [],
    "warnings": [
      "mistakes.f408[45](CN-2-2.2 传输介质) 无「正确率 X/Y ≈ Z%」行，408错题本.md 该节格式可能不合约定",
      "mistakes.f408[51](CN-3-3.7 广域网) 无「正确率 X/Y ≈ Z%」行，408错题本.md 该节格式可能不合约定",
      "mistakes.f408[56](CN-4-4.5 IP多播) 无「正确率 X/Y ≈ Z%」行，408错题本.md 该节格式可能不合约定",
      "mistakes.f408[64](套卷-2022年真题) 无「正确率 X/Y ≈ Z%」行，408错题本.md 该节格式可能不合约定"
    ],
    "strict": false
  },
  "knownQuirks": {
    "r1Queue.date": "相对本机生成日的排期（generatedAt 当天 +1 起，每天 5 道）；消费方须按 generatedAt 重算，不可当作绝对日期展示",
    "DATA区块": "进度看板.html 内 // ==== DATA:GENERATED-BEGIN/END 之间由本脚本重写，其余 CSS/JS 为手工维护且不会被覆盖"
  },
  "data": {
    "lectures": [
      {
        "num": 1,
        "name": "函数极限与连续",
        "pct": 65,
        "cat": "极限"
      },
      {
        "num": 2,
        "name": "数列极限",
        "pct": 68,
        "cat": "极限"
      },
      {
        "num": 3,
        "name": "微分学的概念",
        "pct": 55,
        "cat": "微分"
      },
      {
        "num": 4,
        "name": "微分学的计算",
        "pct": 63,
        "cat": "微分"
      },
      {
        "num": 5,
        "name": "微分学应用·几何应用",
        "pct": 63,
        "cat": "微分"
      },
      {
        "num": 6,
        "name": "微分学应用·中值定理、微分等式与不等式",
        "pct": 55,
        "cat": "微分"
      },
      {
        "num": 7,
        "name": "微分学应用·物理应用与经济应用",
        "pct": 100,
        "cat": "微分",
        "skip": true
      },
      {
        "num": 8,
        "name": "积分学的概念与性质",
        "pct": 69,
        "cat": "积分"
      },
      {
        "num": 9,
        "name": "积分学的计算",
        "pct": 52,
        "cat": "积分"
      },
      {
        "num": 10,
        "name": "积分学应用·几何应用",
        "pct": 52,
        "cat": "积分"
      },
      {
        "num": 11,
        "name": "积分学应用·积分等式与不等式",
        "pct": 41,
        "cat": "积分"
      },
      {
        "num": 12,
        "name": "积分学应用·物理应用与经济应用",
        "pct": 60,
        "cat": "积分"
      },
      {
        "num": 13,
        "name": "多元函数微分学",
        "pct": 36,
        "cat": "多元"
      },
      {
        "num": 14,
        "name": "二重积分",
        "pct": 41,
        "cat": "多元"
      },
      {
        "num": 15,
        "name": "微分方程",
        "pct": 0,
        "cat": "方程",
        "fail": true
      }
    ],
    "subjects": [
      {
        "name": "高数一轮",
        "pct": 100,
        "color": "var(--green)",
        "note": "15/15讲，R1 264/317道"
      },
      {
        "name": "线代",
        "pct": 100,
        "color": "var(--green)",
        "note": "第19-24讲完成"
      },
      {
        "name": "数据结构",
        "pct": 93,
        "color": "var(--green)",
        "note": "6/7章"
      },
      {
        "name": "计组",
        "pct": 100,
        "color": "var(--green)",
        "note": "6章完成（第4章略）"
      },
      {
        "name": "操作系统",
        "pct": 90,
        "color": "var(--green)",
        "note": "4章完成+1章进行中"
      },
      {
        "name": "计网",
        "pct": 17,
        "color": "var(--red)",
        "note": "1/6章完成"
      },
      {
        "name": "英语",
        "pct": 10,
        "color": "var(--red)",
        "note": "单词完成，阅读15篇"
      },
      {
        "name": "政治",
        "pct": 0,
        "color": "var(--red)",
        "note": "未开始"
      }
    ],
    "priorities": [
      {
        "text": "OS一轮收尾：仅剩 5.3磁盘与固态硬盘(43题)，做完即四门一轮拉齐",
        "urgent": true
      },
      {
        "text": "数学错题R1收尾：剩53道（13讲21 + 14讲17 + 15讲习10 + 11/12讲5），9/10前完成",
        "urgent": true
      },
      {
        "text": "计网启动：9月内过完一轮（当前最大短板）",
        "urgent": true
      },
      {
        "text": "DS排序：第7章补完 + 王道选择题",
        "urgent": true
      },
      {
        "text": "数学强化收尾：高数积分(9讲52%)、多元微分(13讲36%)仍是弱项，随后进真题",
        "urgent": true
      },
      {
        "text": "英语：阅读每天1篇精做（2011英二已完成，~60%），单词二轮启动",
        "urgent": false
      },
      {
        "text": "政治：徐涛强化课 + 1000题一刷启动",
        "urgent": false
      },
      {
        "text": "CN 4.2 复盘：重点研究错题 58（默认网关/路由器转发）、59（/30点对点+NAT源地址）、64（VLSM变长子网划分）、65（子网划分合法性）；另加做 45 题（链路层封装相关，未完全吃透）",
        "urgent": false
      },
      {
        "text": "数学：2019真题线代错题 t14/t22/t23 重做",
        "urgent": false
      },
      {
        "text": "英语：2015 text3 精读",
        "urgent": false
      }
    ],
    "r1Queue": [
      {
        "date": "10/24",
        "txt": "第11讲: 习2,习3,习4 + 第12讲: 例2,习3",
        "n": 5
      },
      {
        "date": "10/25",
        "txt": "第13讲: 例2,例4,例5,例6,例7",
        "n": 5
      },
      {
        "date": "10/26",
        "txt": "第13讲: 例8,例9,例11,例12,例13",
        "n": 5
      },
      {
        "date": "10/27",
        "txt": "第13讲: 例17,例18,例19,例20,例21",
        "n": 5
      },
      {
        "date": "10/28",
        "txt": "第13讲: 例22,习1,习3,习5,习9",
        "n": 5
      },
      {
        "date": "10/29",
        "txt": "第13讲: 习13 + 第14讲: 例2,例4,例6,例7",
        "n": 5
      },
      {
        "date": "10/30",
        "txt": "第14讲: 例8,例9,例11,例12,例13",
        "n": 5
      },
      {
        "date": "10/31",
        "txt": "第14讲: 例14,例17,习1,习5,习6",
        "n": 5
      },
      {
        "date": "11/1",
        "txt": "第14讲: 习7,习10,习12 + 第15讲: 习1,习2",
        "n": 5
      },
      {
        "date": "11/2",
        "txt": "第15讲: 习3,习4,习5,习6,习7",
        "n": 5
      },
      {
        "date": "11/3",
        "txt": "第15讲: 习10,习12,习13",
        "n": 3
      }
    ],
    "coop": [
      {
        "name": "第1章 计算机系统概述",
        "status": "done",
        "note": "已完成+王道选择题"
      },
      {
        "name": "第2章 数据的表示和运算",
        "status": "done",
        "note": "浮点数加减法收尾完成"
      },
      {
        "name": "第3章 存储系统",
        "status": "done",
        "note": "期末重合度高，已完成"
      },
      {
        "name": "第4章 指令系统",
        "status": "skip",
        "note": "本科已学AT&T/Intel机器级表示，强化阶段补"
      },
      {
        "name": "第5章 中央处理器(CPU)",
        "status": "done",
        "note": "5-4+5-6+5-7王道选择题完成"
      },
      {
        "name": "第6章 总线",
        "status": "done",
        "note": "6-1+6-2王道选择题完成"
      },
      {
        "name": "第7章 输入/输出系统",
        "status": "done",
        "note": "7-1+7-2+7-3王道选择题完成"
      }
    ],
    "ds": [
      {
        "name": "第1章 绪论",
        "status": "done",
        "note": ""
      },
      {
        "name": "第2章 线性表",
        "status": "done",
        "note": ""
      },
      {
        "name": "第3章 栈和队列",
        "status": "done",
        "note": ""
      },
      {
        "name": "第4章 树与二叉树",
        "status": "done",
        "note": ""
      },
      {
        "name": "第5章 图",
        "status": "done",
        "note": ""
      },
      {
        "name": "第6章 查找",
        "status": "done",
        "note": "7.2(17/23)+7.3(28/33)+7.4(18/24)+7.5(15/23)完成，各节均有少量题未做 ⚠️小程序编号为第7章"
      },
      {
        "name": "第7章 排序",
        "status": "progress",
        "note": "8.2(20/20)+8.3(14/19)+8.4(17/20)+8.5(15/19)完成，8.1及8.6-8.7待做 ⚠️小程序编号为第8章"
      }
    ],
    "os": [
      {
        "name": "第1章 操作系统概述",
        "status": "done",
        "note": "1.1+1.2+1.3+1.6完成（服务端84/88）"
      },
      {
        "name": "第2章 进程管理",
        "status": "done",
        "note": "2.1-2.4完成（服务端224/276）"
      },
      {
        "name": "第3章 内存管理",
        "status": "done",
        "note": "3.1(70/83)+3.2(58/83)完成"
      },
      {
        "name": "第4章 文件管理",
        "status": "done",
        "note": "4.1(5/5)+4.2(67/85)+4.3(16/20)完成"
      },
      {
        "name": "第5章 I/O管理",
        "status": "progress",
        "note": "5.1(26/28)+5.2(36/45)完成，5.3待做（43题）"
      }
    ],
    "net": [
      {
        "name": "第1章 计算机网络概述",
        "status": "done",
        "note": "1.1(14/17)+1.2(24/36)完成；1.2体系结构是短板，OSI各层功能边界需回炉"
      },
      {
        "name": "第2章 物理层",
        "status": "todo",
        "note": ""
      },
      {
        "name": "第3章 数据链路层",
        "status": "todo",
        "note": ""
      },
      {
        "name": "第4章 网络层",
        "status": "todo",
        "note": ""
      },
      {
        "name": "第5章 传输层",
        "status": "todo",
        "note": ""
      },
      {
        "name": "第6章 应用层",
        "status": "todo",
        "note": ""
      }
    ],
    "la": [
      {
        "name": "第0讲 零基础课程",
        "status": "done",
        "note": ""
      },
      {
        "name": "第19讲 行列式",
        "status": "done",
        "note": "~58%"
      },
      {
        "name": "第20讲 矩阵",
        "status": "done",
        "note": "~55%"
      },
      {
        "name": "第21讲 向量组",
        "status": "done",
        "note": "~42%"
      },
      {
        "name": "第22讲 线性方程组",
        "status": "done",
        "note": "~33%"
      },
      {
        "name": "第23讲 特征值与特征向量",
        "status": "done",
        "note": "~42%"
      },
      {
        "name": "第24讲 二次型",
        "status": "done",
        "note": "~60%"
      }
    ],
    "r1": [
      {
        "ch": "第1讲 函数极限与连续",
        "total": 26,
        "done": 26,
        "items": "全部完成"
      },
      {
        "ch": "第2讲 数列极限",
        "total": 12,
        "done": 12,
        "items": "全部完成"
      },
      {
        "ch": "第3讲 一元函数微分学的概念",
        "total": 12,
        "done": 12,
        "items": "全部完成"
      },
      {
        "ch": "第4讲 一元函数微分学的计算",
        "total": 15,
        "done": 15,
        "items": "全部完成"
      },
      {
        "ch": "第5讲 微分学应用(一)——几何应用",
        "total": 21,
        "done": 21,
        "items": "全部完成"
      },
      {
        "ch": "第6讲 微分学应用(二)——中值定理、微分等式与不等式",
        "total": 16,
        "done": 16,
        "items": "全部完成"
      },
      {
        "ch": "第7讲 微分学应用(三)——物理应用与经济应用",
        "total": 0,
        "done": 0,
        "items": "全部完成"
      },
      {
        "ch": "第8讲 一元函数积分学的概念与性质",
        "total": 8,
        "done": 8,